<?xml version="1.0" encoding="UTF-8"?>
<!ELEMENT Modules (Module)+ >
<!ELEMENT Module (ModuleName, ElementName1, ElementName2, Dept_Attachement) >
<!ELEMENT ModuleName (#PCDATA) >
<!ELEMENT ElementName1 (#PCDATA) >
<!ELEMENT ElementName2 (#PCDATA) >
<!ELEMENT Dept_Attachement (#PCDATA) >